{"schemaVersion":"1.0.0","objective":{"kind":"weighted-conservative-utility","weights":{"effectiveness":4,"productivity":2,"stability":2,"safety":5},"tieTolerance":0.01,"thresholds":{"effectiveness":{"minimum":0.6},"productivity":{"minimum":0.5},"stability":{"minimum":0.7},"safety":{"minimum":0.85}},"criticalSafetyMinimum":0.8},"uncertainty":{"minimumSamples":20,"maximumSamples":1000,"maximumIntervalWidth":{"effectiveness":0.1,"productivity":0.1,"stability":0.08,"safety":0.05}},"candidates":[{"candidateId":"alpha","candidateHash":"aaaaaaaaaaaaaaaaaaaaaaaaaaaaaaaaaaaaaaaaaaaaaaaaaaaaaaaaaaaaaaaa","metrics":{"effectiveness":{"estimate":0.82,"lowerBound":0.78,"upperBound":0.86,"sampleSize":40,"evidenceHashes":["1111111111111111111111111111111111111111111111111111111111111111"]},"productivity":{"estimate":0.72,"lowerBound":0.68,"upperBound":0.76,"sampleSize":40,"evidenceHashes":["2222222222222222222222222222222222222222222222222222222222222222"]},"stability":{"estimate":0.86,"lowerBound":0.83,"upperBound":0.89,"sampleSize":40,"evidenceHashes":["3333333333333333333333333333333333333333333333333333333333333333"]},"safety":{"estimate":0.94,"lowerBound":0.92,"upperBound":0.96,"sampleSize":40,"evidenceHashes":["4444444444444444444444444444444444444444444444444444444444444444"]}}},{"candidateId":"beta","candidateHash":"bbbbbbbbbbbbbbbbbbbbbbbbbbbbbbbbbbbbbbbbbbbbbbbbbbbbbbbbbbbbbbbb","metrics":{"effectiveness":{"estimate":0.7,"lowerBound":0.66,"upperBound":0.74,"sampleSize":40,"evidenceHashes":["5555555555555555555555555555555555555555555555555555555555555555"]},"productivity":{"estimate":0.62,"lowerBound":0.58,"upperBound":0.66,"sampleSize":40,"evidenceHashes":["6666666666666666666666666666666666666666666666666666666666666666"]},"stability":{"estimate":0.78,"lowerBound":0.74,"upperBound":0.82,"sampleSize":40,"evidenceHashes":["7777777777777777777777777777777777777777777777777777777777777777"]},"safety":{"estimate":0.9,"lowerBound":0.88,"upperBound":0.92,"sampleSize":40,"evidenceHashes":["8888888888888888888888888888888888888888888888888888888888888888"]}}}]}
